{
  "$schema": "https://raw.githubusercontent.com/giocaizzi/CV/main/cv_builder/templates/resume/schema.json",
  "basics": {
    "name": "Giorgio Caizzi",
    "email": "giocaizzi@gmail.com",
    "location": "Milan, Italy",
    "profiles": [
      {
        "network": "LinkedIn",
        "url": "https://linkedin.com/in/giorgio-caizzi/",
        "x-inResume": true
      },
      {
        "network": "GitHub",
        "url": "https://www.github.com/giocaizzi/",
        "x-inResume": true
      },
      {
        "network": "Website",
        "url": "https://giocaizzi.xyz/",
        "x-inResume": true
      }
    ]
  },
  "work": [
    {
      "position": "Product Senior Engineer - Generative AI",
      "name": "Jakala S.p.A.",
      "location": "Milan, Italy",
      "startDate": "2024-05",
      "endDate": null,
      "summary": "Developement of end-to-end Generative AI solutions tailored to industry needs -from research and prototyping to deployment to the Cloud- with a focus on observability and cost-effectiveness.",
      "x-longSummary": "",
      "highlights": [
        {
          "value": "RAG and BI Agents, multimodal LLMs, Multi-agentic patterns and orchestration.",
          "x-inResume": true
        },
        {
          "value": "DevOps for GenAI and LLMOps: TDD for GenAI Agents, groundedness and guardrailing, deployment to production, CloudOps, monitoring and evaluation of Agents outputs and performance.",
          "x-inResume": true
        }
      ],
      "x-projects": [
        {
          "name": "",
          "description": "",
          "x-technologies": "Python, LangChain, OpenAI API, Azure OpenAI, Pinecone, FastAPI, Docker, Azure Container Apps",
          "achievements": [
            "",
            ""
          ],
          "client": "",
          "x-inResume": false
        }
      ],
      "x-inResume": true
    },
    {
      "position": "Environmental Engineer",
      "name": "AECOM URS Italia S.p.A.",
      "location": "Milan, Italy",
      "startDate": "2021-02",
      "endDate": "2024-05",
      "summary": "Technical consultancy on remediation procedures in industrial sites across Italy, in compliance with D.Lgs.152/06.",
      "x-longSummary": "",
      "highlights": [
        {
          "value": "Developing solutions for effective collection, processing, analysis and restitution of environmental spatial data.",
          "x-inResume": true
        },
        {
          "value": "Project management: budgeting, proposals, planning, and billing. Regular meetings with clients.",
          "x-inResume": true
        },
        {
          "value": "Design and implementation of investigation and remediation activities for contaminated water and soils.",
          "x-inResume": false
        },
        {
          "value": "Field supervision of technical activities carried out by subcontractors.",
          "x-inResume": false
        },
        {
          "value": "Relations with national and local authorities (ARPA, Ministry of Environment, Municipalities).",
          "x-inResume": false
        }
      ],
      "x-inResume": true
    },
    {
      "position": "External Collaborator",
      "name": "Wiseair S.r.l.",
      "location": "Milan, Italy & Lisbon, Portugal",
      "startDate": "2020-03",
      "endDate": "2020-12",
      "summary": "Development of a GIS-based framework for spatial interpolation of PM2.5 concentration data, taking into account the contribution of urban features and their morphology in the dispersion of pollutants.",
      "x-longSummary": "Development of a GIS-based framework for spatial interpolation of PM2.5 concentration data, using real-time data from a dense network of measuring stations and taking into account the contribution of urban features and their morphology in the dispersion of pollutants.",
      "highlights": [
        {
          "value": "Automated processing of real-time pollutant concentration data, using python and GIS tools.",
          "x-inResume": false
        },
        {
          "value": "Development of a tool to assess compliance with air quality international health guidelines.",
          "x-inResume": false
        }
      ],
      "x-inResume": true
    },
    {
      "position": "Event specialist - \"Citycrusher\" Team",
      "name": "Red Bull Italia S.r.l.",
      "location": "Milan, Italy",
      "startDate": "2017-09",
      "endDate": "2020-09",
      "summary": "Managining brand-activation of Red Bull Citycrusher event-car in selected sport events in Italy.",
      "x-longSummary": "",
      "highlights": [],
      "x-inResume": true
    },
    {
      "position": "Hero Team Promoter",
      "name": "GoPro EMEA GmbH",
      "location": "Munich, Germany",
      "startDate": "2014-05",
      "endDate": "2019-09",
      "summary": "Promotion of cameras and brand-activation in selected events in Europe.",
      "x-longSummary": "",
      "highlights": [],
      "x-inResume": true
    }
  ],
  "education": [
    {
      "area": "BSc & MSc in Environmental and Land Planning Engineering",
      "institution": "Politecnico di Milano",
      "location": "Milan, Italy",
      "startDate": "2014-09",
      "endDate": "2020-12",
      "x-details": {
        "msc": {
          "courses": "Data structures, analysis & ML for environment - Advanced Statistics - Advanced GIS - Databases and Spatial SQL",
          "thesis": "Spatial interpolation methods for producing high-resolution PM2.5 concentration maps in Milan, Italy"
        },
        "bsc": {
          "courses": "Soil & groundwater remediation - Sustainability - Climate change mitigation - Hydrology - Hydraulics - Geology",
          "thesis": "Environmental and economical impact of Case dell'Acqua, a free drinking-water distribution project in Milan by MM S.p.A."
        }
      },
      "x-inResume": true
    },
    {
      "area": "International Baccalaureate (IB Diploma)",
      "institution": "The British School of Brussels",
      "location": "Brussels, Belgium",
      "startDate": "2012-09",
      "endDate": "2014-05",
      "x-details": {},
      "x-inResume": true
    }
  ],
  "certificates": [
    {
      "name": "Italian National Assotiation of Engineers",
      "date": "2021",
      "x-inResume": true
    }
  ],
  "technicalSkills": {
    "Programming": {
      "value": "Python, JavaScript & TypeScript, shell scripting",
      "x-inResume": true
    },
    "Cloud": {
      "value": "Infrastructures on AWS, GCP & Azure, Cloudflare",
      "x-inResume": true
    },
    "Deployments": {
      "value": "Docker & Docker Swarm, Serverless, orchestration",
      "x-inResume": true
    },
    "Data": {
      "value": "SQL & noSQL, Redis, graphs",
      "x-inResume": true
    },
    "Development": {
      "value": "CI/CD pipelines, git, testing, documentation",
      "x-inResume": true
    },
    "GenAI": {
      "value": "Langchain,OpenAI API, HuggingFace, langgraph, LlamaIndex,  MS Copilot Studio",
      "x-inResume": true
    },
    "API": {
      "value": "REST & GraphQL, OpenAPI specifications",
      "x-inResume": true
    },
    "Observability": {
      "value": "Opentelemetry - Grafana stack: Prometheus,Loki,Tempo, Alloy",
      "x-inResume": true
    },
    "Web frameworks": {
      "value": "Flask, FastAPI, Django, Express, Nest.js, Next.js",
      "x-inResume": true
    },
    "Data Science": {
      "value": "pytorch, pandas, numpy, sklearn",
      "x-inResume": true
    },
    "GIS": {
      "value": "ArcGIS, QGis, PostGIS, GDAL, geopandas, shapely, rasterio",
      "x-inResume": true
    },
    "Writing": {
      "value": "LaTeX, Markdown & reStructuredText",
      "x-inResume": true
    },
    "Web": {
      "value": "HTML & CSS, TailwindCSS",
      "x-inResume": true
    },
    "CAD": {
      "value": "AutoCAD, Civil3D",
      "x-inResume": false
    },
    "Business Intelligence": {
      "value": "Power BI (M & DAX)",
      "x-inResume": false
    },
    "Workflows & Automation": {
      "value": "n8n, MS Power Automate",
      "x-inResume": false
    }
  },
  "projects": [
    {
      "name": "py3dinterpolations",
      "url": "https://github.com/giocaizzi/py3dinterpolations",
      "description": "quick 3D spatial interpolations",
      "x-technologies": "python, pandas & geopandas, scikit-learn, numpy, shapely, pyproj",
      "x-inResume": true
    },
    {
      "name": "mplstrater",
      "url": "https://github.com/giocaizzi/mplstrater",
      "description": "plot stratigraphic logs with matplotlib",
      "x-technologies": "python, pandas & geopandas, matplotlib, shapely, rasterio",
      "x-inResume": true
    },
    {
      "name": "pysurfline",
      "url": "https://github.com/giocaizzi/pysurfline",
      "description": "wrapper for surfline.com API",
      "x-technologies": "python, pandas, requests, APIs",
      "x-inResume": false
    },
    {
      "name": "repomanager",
      "url": "https://github.com/giocaizzi/repomanager",
      "description": "easily manage GitHub repositories",
      "x-technologies": "python, Flask, Jinja2, HTML, CSS, APIs",
      "x-inResume": false
    },
    {
      "name": "smart-spotify",
      "url": "https://github.com/giocaizzi/smart-spotify",
      "description": "create smart playlists with Spotify",
      "x-technologies": "JavaScript, node.js, Express, HTML, CSS, APIs",
      "x-inResume": true
    }
  ],
  "personalSkills": {
    "Languages": {
      "value": "Fluency in Italian (mothertongue) and English. French at professional level.",
      "x-inResume": true
    },
    "Interests": {
      "value": "skiing, surfing, road-cycling and outdoors. Cartography, infographics and mapping. Tech and AI.",
      "x-inResume": true
    }
  },
  "meta": {
    "footer": {
      "value": "References and letters of recommendation available on request.",
      "x-inResume": false
    }
  }
}
